contexte gauche,motif trouve,contexte droit
"...st match results, transfer rum",or,"s, or anything football-relate..."
"...tch results, transfer rumors, ",or," anything football-related, th..."
"...st match results, transfer rum",or,"s, or anything football-relate..."
"...tch results, transfer rumors, ",or," anything football-related, th..."
"... you, I enjoy simulating the W",or,"ld Cup draw. However, with the..."
"...ever, with the new **48-team f",or,mat (12 groups)** coming in 20...
... manual draw with paper slips ,or, balls has become a mathematic...
"...to act as a ""Draw Assistant"" f",or, manual simulations. It’s not ...
...It’s not just a random generat,or,; it works alongside you while...
... just a random generator; it w,or,ks alongside you while you dra...
... balls physically.  **How it w,or,ks:**  1. You draw a team (e.g...
...tool uses a **backtracking alg,or,ithm with lookahead** to check...
...ch group the team goes to (enf,or,cing all FIFA rules) or stops ...
...to (enforcing all FIFA rules) ,or, stops you if the move would b...
...ys have a valid slot waiting f,or, them).  **I need your feedbac...
"... edge cases, but I’m looking f",or, more people to try it out.  I...
"...e cases, but I’m looking for m",or,e people to try it out.  If yo...
... you are interested in the alg,or,ithm or just want to run a cle...
...e interested in the algorithm ,or, just want to run a clean draw...
...ar your thoughts on the logic ,or, if you find any edge cases I ...
...ps://github.com/holasoyedgar/w,or,ld-cup-2026-draw-assistant**](...
...ps://github.com/holasoyedgar/w,or,ld-cup-2026-draw-assistant) Be...
...uring head impact kinematics f,or, assisting in understanding th...
...their use as a research tool f,or, understanding concussive impa...
...y that uses a pneumatic impact,or, to deliver impacts characteri...
...football to a Hybrid III headf,or,"m, in order to validate and co..."
"... to a Hybrid III headform, in ",or,der to validate and compare fi...
...s gave accurate measurements f,or, the peak angular acceleration...
...cceleration (mean relative err,or,", MRE < 13%), the peak angular..."
...lues (MRE < 13%) and brain def,or,mation (described as maximum p...
...by a convolutional neural netw,or,"k based brain model, MRE < 9%)..."
...itive to the impact velocity f,or, the most part. We prove that ...
...ve examples showing that the c,or,responding result is not true ...
...esponding result is not true f,or, footballs of higher genera. M...
... footballs of higher genera. M,or,"eover, we classify the possibl..."
"...ify the possible pairs (k,l) f",or, which football patterns on th...
...er we examine the detailed the,or,y of the American football in ...
...ance included. We find the the,or,y has much in common with the ...
...as much in common with the the,or,y of a gyroscope and also rock...
...oscope and also rocket traject,or,y with a misaligned thruster. ...
...ith a misaligned thruster. Unf,or,tunately most of the air resis...
"... of the air resistance data, f",or," rocketry and ballistics, is f..."
"... rocketry and ballistics, is f",or," speeds of Mach 1 or higher, w..."
"...tics, is for speeds of Mach 1 ",or," higher, where the air resista..."
"...football flight, with a drag f",or,ce proportional to cross secti...
"...flight, with a drag force prop",or,tional to cross sectional area...
...sectional area and either $v$ ,or," $v^2$, depending on speed, wh..."
... We point out the previous err,or,s made with moments of inertia...
...ertia and make the necessary c,or,rections for more accurate res...
...ke the necessary corrections f,or, more accurate results. We sho...
...he necessary corrections for m,or,e accurate results. We show th...
...tial of predictive modelling f,or, football injuries. This work ...
... for football injuries. This w,or,k was conducted in close colla...
... was conducted in close collab,or,ation with Tottenham Hotspurs ...
...ries using the UEFA injury rec,or,dings: The UEFA recordings is ...
...njury recordings: The UEFA rec,or,dings is a common standard for...
...ordings is a common standard f,or, recording injuries in profess...
...s is a common standard for rec,or,ding injuries in professional ...
...es in professional football. F,or," this investigation, three dat..."
...ee datasets of UEFA injury rec,or,dings were available. Differen...
...Different machine learning alg,or,ithms were used in order to bu...
...rning algorithms were used in ,or,der to build a predictive mode...
...d a predictive model. The perf,or,mance of the machine learning ...
... selection conducted through c,or,relation-based subset feature ...
...feature selection and random f,or,ests.   2. Predicting injuries...
...al football using exposure rec,or,ds: The relationship between e...
...of days a player can train bef,or,e he gets injured.   3. Predic...
...sessions might provide indicat,or,"s of fatigue, or might be used..."
"...rovide indicators of fatigue, ",or, might be used to detect very ...
"...of the first team of THFC, in ",or,der to predict whether an inju...
... of football players is an imp,or,tant part in football games. M...
...but not on the transfer behavi,or," itself. Based on the 470,792 ..."
"...ed on the 470,792 transfer rec",or,"ds from 1990 to 2016 among 23,..."
...ected footballer transfer netw,or,"k (FTN), where the nodes are t..."
...football clubs and the links c,or,respond to the footballer tran...
...l. We further figure out the c,or,relations between node degrees...
... of different measures of netw,or,k centrality. Our network anal...
...f network centrality. Our netw,or,k analysis of the global footb...
