contexte gauche,motif trouve,contexte droit,mot_recherche
**Welcome to ,the, Weekly Discussion Thread...,the
...iscussion Thread!**   Whe,the,r you're here to chat abo...,the
...ou're here to chat about ,the," latest match results, tr...",the
"...ootball-related, this is ",the, place to be. Feel free t...,the
... this week. **Welcome to ,the, Weekly Discussion Thread...,the
...iscussion Thread!**   Whe,the,r you're here to chat abo...,the
...ou're here to chat about ,the," latest match results, tr...",the
"...ootball-related, this is ",the, place to be. Feel free t...,the
"... you, I enjoy simulating ",the," World Cup draw. However,...",the
"... Cup draw. However, with ",the, new **48-team format (12...,the
... or balls has become a ma,the,matical nightmare.  There...,the
...mathematical nightmare.  ,The,re are so many constraint...,the
...e left with teams that ma,the,matically cannot fit into...,the
...atically cannot fit into ,the, remaining empty groups. ...,the
...maining empty groups.  **,The, Solution** I wrote a Pyt...,the
...gside you while you draw ,the, balls physically.  **How...,the
...a bowl/pot). 2. You type ,the, Team ID into the tool. 3...,the
...ou type the Team ID into ,the, tool. 3. The tool uses a...,the
...eam ID into the tool. 3. ,The, tool uses a **backtracki...,the
... you exactly which group ,the, team goes to (enforcing ...,the
...A rules) or stops you if ,the, move would break the dra...,the
... if the move would break ,the, draw later on.  **Featur...,the
...**Features:**  * Handles ,the, new 12-group architectur...,the
"...(Mexico, Canada, USA) in ",the,ir specific slots. * Prev...,the
...a valid slot waiting for ,the,m).  **I need your feedba...,the
...If you are interested in ,the, algorithm or just want t...,the
...to hear your thoughts on ,the, logic or if you find any...,the
...aw-assistant) Because of ,the, relatively rigid couplin...,the
...y rigid coupling between ,the, upper dentition and the ...,the
... the upper dentition and ,the," skull, instrumented mout...",the
...sisting in understanding ,the, underlying biomechanics ...,the
...s and institutions to fur,the,r develop instrumented mo...,the
"...ed mouthguards. However, ",the,ir use as a research tool...,the
... makes quantification of ,the,"ir accuracy critical, esp...",the
"...itical, especially given ",the, conflicting results from...,the
...date and compare five of ,the, most commonly used instr...,the
...ccurate measurements for ,the, peak angular acceleratio...,the
"...ative error, MRE < 13%), ",the, peak angular velocity (M...,the
".... Finally, we found that ",the, accuracy of the measurem...,the
...und that the accuracy of ,the, measurement varies with ...,the
... measurement varies with ,the, impact locations yet is ...,the
... yet is not sensitive to ,the, impact velocity for the ...,the
... the impact velocity for ,the, most part. We prove that...,the
"... cover, branched only in ",the," vertices, of the standar...",the
"...only in the vertices, of ",the, standard football made u...,the
...ve examples showing that ,the, corresponding result is ...,the
"...a. Moreover, we classify ",the," possible pairs (k,l) for...",the
...ich football patterns on ,the, sphere exist satisfying ...,the
...atural generalisation of ,the, usual incidence relation...,the
...In this paper we examine ,the, detailed theory of the A...,the
... we examine the detailed ,the,ory of the American footb...,the
...e the detailed theory of ,the, American football in fli...,the
...stance included. We find ,the, theory has much in commo...,the
...ce included. We find the ,the,ory has much in common wi...,the
... has much in common with ,the, theory of a gyroscope an...,the
... much in common with the ,the,ory of a gyroscope and al...,the
...r. Unfortunately most of ,the," air resistance data, for...",the
"... Mach 1 or higher, where ",the, air resistance increases...,the
"...istic air resistance, at ",the, slower speeds of footbal...,the
...oss sectional area and ei,the,"r $v$ or $v^2$, depending...",the
...where $v$ is velocity of ,the, football. We begin with ...,the
...gin with a discussion of ,the," motion, giving as much d...",the
...tail as possible without ,the, use of complex analytic ...,the
...lculations. We point out ,the, previous errors made wit...,the
...ents of inertia and make ,the, necessary corrections fo...,the
...te results. We show that ,the, shape of an American foo...,the
... parabola of revolution. ,The, goal of this thesis is t...,the
...lution. The goal of this ,the,sis is to investigate the...,the
...thesis is to investigate ,the, potential of predictive ...,the
"...nham Hotspurs FC (THFC), ",the, PGA European tour and th...,the
...he PGA European tour and ,the, participation of Wolverh...,the
...nducted:   1. Predicting ,the, recovery time of footbal...,the
... football injuries using ,the, UEFA injury recordings: ...,the
... UEFA injury recordings: ,The, UEFA recordings is a com...,the
...uild a predictive model. ,The, performance of the machi...,the
...odel. The performance of ,the, machine learning models ...,the
...chine learning models is ,the,n improved by using featu...,the
... using exposure records: ,The, relationship between exp...,the
...all is understanding how ,the, training schedule of an ...,the
...of an athlete can affect ,the, chance of him getting in...,the
... of him getting injured. ,The, task was to predict the ...,the
... The task was to predict ,the, number of days a player ...,the
...research used GPS data ga,the,red during training sessi...,the
...ing training sessions of ,the," first team of THFC, in o...",the
"..., in order to predict whe",the,r an injury would take pl...,the
...ake place during a week. ,The, transfer of football pla...,the
...l games. Most studies on ,the, transfer of football pla...,the
...ootball players focus on ,the, transfer system and tran...,the
...transfer fees but not on ,the, transfer behavior itself...,the
...ehavior itself. Based on ,the," 470,792 transfer records...",the
"...fer network (FTN), where ",the, nodes are the football c...,the
"...TN), where the nodes are ",the, football clubs and the l...,the
...e the football clubs and ,the, links correspond to the ...,the
... the links correspond to ,the, footballer transfers. A ...,the
... analysis is conduced on ,the, topological properties o...,the
...opological properties of ,the, FTN. We find that the in...,the
...of the FTN. We find that ,the," in-degrees, out-degrees,...",the
"...xponential decay), while ",the, distribution of link wei...,the
... a power-law tail. We fur,the,r figure out the correlat...,the
...l. We further figure out ,the, correlations between nod...,the
...hts. We also investigate ,the, general characteristics ...,the
... Our network analysis of ,the, global footballer transf...,the
...et sheds new lights into ,the, investigation of the cha...,the
...nto the investigation of ,the, characteristics of trans...,the
"... either $v$ or $v^2$, dep",end,"ing on speed, where $v$ i...",end
"...tch results, transfer rum",or,"s, or anything football-r...",or
"...esults, transfer rumors, ",or, anything football-relate...,or
"...tch results, transfer rum",or,"s, or anything football-r...",or
"...esults, transfer rumors, ",or, anything football-relate...,or
... I enjoy simulating the W,or,"ld Cup draw. However, wit...",or
... with the new **48-team f,or,mat (12 groups)** coming ...,or
...al draw with paper slips ,or, balls has become a mathe...,or
"...t as a ""Draw Assistant"" f",or, manual simulations. It’s...,or
...not just a random generat,or,; it works alongside you ...,or
... a random generator; it w,or,ks alongside you while yo...,or
...s physically.  **How it w,or,ks:**  1. You draw a team...,or
...uses a **backtracking alg,or,ithm with lookahead** to ...,or
...oup the team goes to (enf,or,cing all FIFA rules) or s...,or
...nforcing all FIFA rules) ,or, stops you if the move wo...,or
...ve a valid slot waiting f,or, them).  **I need your fe...,or
"... cases, but I’m looking f",or, more people to try it ou...,or
"...es, but I’m looking for m",or,e people to try it out.  ...,or
...are interested in the alg,or,ithm or just want to run ...,or
...erested in the algorithm ,or, just want to run a clean...,or
...ur thoughts on the logic ,or, if you find any edge cas...,or
...github.com/holasoyedgar/w,or,ld-cup-2026-draw-assistan...,or
...github.com/holasoyedgar/w,or,ld-cup-2026-draw-assistan...,or
... head impact kinematics f,or, assisting in understandi...,or
... use as a research tool f,or, understanding concussive...,or
...t uses a pneumatic impact,or, to deliver impacts chara...,or
...all to a Hybrid III headf,or,"m, in order to validate a...",or
"... Hybrid III headform, in ",or,der to validate and compa...,or
...e accurate measurements f,or, the peak angular acceler...,or
...ration (mean relative err,or,", MRE < 13%), the peak an...",or
...(MRE < 13%) and brain def,or,mation (described as maxi...,or
...convolutional neural netw,or,"k based brain model, MRE ...",or
... to the impact velocity f,or, the most part. We prove ...,or
...amples showing that the c,or,responding result is not ...,or
...ding result is not true f,or, footballs of higher gene...,or
...balls of higher genera. M,or,"eover, we classify the po...",or
"...he possible pairs (k,l) f",or, which football patterns ...,or
... examine the detailed the,or,y of the American footbal...,or
...included. We find the the,or,y has much in common with...,or
...ch in common with the the,or,y of a gyroscope and also...,or
...e and also rocket traject,or,y with a misaligned thrus...,or
... misaligned thruster. Unf,or,tunately most of the air ...,or
"...he air resistance data, f",or," rocketry and ballistics,...",or
"...etry and ballistics, is f",or, speeds of Mach 1 or high...,or
... is for speeds of Mach 1 ,or," higher, where the air re...",or
"...all flight, with a drag f",or,ce proportional to cross ...,or
"...t, with a drag force prop",or,tional to cross sectional...,or
...onal area and either $v$ ,or," $v^2$, depending on spee...",or
...oint out the previous err,or,s made with moments of in...,or
... and make the necessary c,or,rections for more accurat...,or
...e necessary corrections f,or, more accurate results. W...,or
...cessary corrections for m,or,e accurate results. We sh...,or
...of predictive modelling f,or, football injuries. This ...,or
...football injuries. This w,or,k was conducted in close ...,or
...conducted in close collab,or,ation with Tottenham Hots...,or
...using the UEFA injury rec,or,dings: The UEFA recording...,or
... recordings: The UEFA rec,or,dings is a common standar...,or
...gs is a common standard f,or, recording injuries in pr...,or
...a common standard for rec,or,ding injuries in professi...,or
... professional football. F,or," this investigation, thre...",or
...tasets of UEFA injury rec,or,dings were available. Dif...,or
...rent machine learning alg,or,ithms were used in order ...,or
... algorithms were used in ,or,der to build a predictive...,or
...redictive model. The perf,or,mance of the machine lear...,or
...ction conducted through c,or,relation-based subset fea...,or
...re selection and random f,or,ests.   2. Predicting inj...,or
...otball using exposure rec,or,ds: The relationship betw...,or
...ys a player can train bef,or,e he gets injured.   3. P...,or
...ons might provide indicat,or,"s of fatigue, or might be...",or
"...e indicators of fatigue, ",or, might be used to detect ...,or
"...e first team of THFC, in ",or,der to predict whether an...,or
...ootball players is an imp,or,tant part in football gam...,or
...ot on the transfer behavi,or, itself. Based on the 470...,or
"... the 470,792 transfer rec",or,ds from 1990 to 2016 amon...,or
... footballer transfer netw,or,"k (FTN), where the nodes ...",or
...all clubs and the links c,or,respond to the footballer...,or
... further figure out the c,or,relations between node de...,or
...ifferent measures of netw,or,k centrality. Our network...,or
...work centrality. Our netw,or,k analysis of the global ...,or
